<!DOCTYPE library SYSTEM "book.dtd">
<library xmlns:dc="http://purl.org/dc/elements/1.1/">
  <articles>
    <dc:title>Internet实用技术</dc:title>
    <dc:creator>邓三鸿 等</dc:author>
    <dc:publisher>清华大学出版社</dc:publisher>
    <date>2010</date>
    <dc:description>本书介绍了互联网的基础知识、网络编程、网络应用等方面的内容。</dc:description>
    <dc:format>图书</dc:format>
    <dc:language>中文</dc:language>
    <dc:identifier>ISBN 978-7-302-22581-4</dc:identifier>
    <dc:subject>互联网技术</dc:subject>
    <dc:type>Text</dc:type>
    <dc:rights>版权所有</dc:rights>
  </articles>
</library>